{
  "$schema": "https://json-schema.org/draft/2020-12/schema",
  "$id": "https://tomestack.local/schemas/content-pack.v1.schema.json",
  "title": "TomeStack content pack (formatVersion 1)",
  "description": "A bundle of sources and content revisions: the bundled SRD packs (src/AppService/Content) and the test fixture packs. Each source is a source.v1 record and each revision a content-revision record of its own schemaVersion; SchemaTests validates them against those schemas separately.",
  "type": "object",
  "required": ["packId", "formatVersion", "sources", "revisions"],
  "additionalProperties": false,
  "properties": {
    "packId": { "type": "string", "pattern": "^[a-z0-9][a-z0-9.-]*$" },
    "formatVersion": { "const": 1 },
    "notice": { "type": "string" },
    "sources": { "type": "array", "minItems": 1, "items": { "type": "object", "required": ["id"] } },
    "revisions": { "type": "array", "items": { "type": "object", "required": ["contentId", "revisionId", "schemaVersion"] } }
  }
}
