{
  "packId": "tomestack-m3-source-update-fixtures",
  "formatVersion": 1,
  "notice": "Original TomeStack test fixture (M3 C7 source updates): a second revision of the invented Fixture Arcanist, as a newer build would ship it. No SRD or third-party rules text.",
  "sources": [
    {
      "id": "5f5d5000-0000-4000-8000-000000000001",
      "title": "TomeStack Fixtures: Spellcasting",
      "publisher": "TomeStack project",
      "rulesFamilies": [
        "srd-5.1",
        "srd-5.2.1"
      ],
      "editionVersion": "fixture-1",
      "license": "Original test fixture",
      "redistributable": true,
      "attribution": "Written for TomeStack tests."
    }
  ],
  "revisions": [
    {
      "contentId": "5f5dc000-0000-4000-8000-000000000001",
      "revisionId": "5f5de700-0000-4000-8000-000000000001",
      "schemaVersion": 7,
      "kind": "class",
      "name": "Fixture Arcanist",
      "rulesFamilies": [
        "srd-5.1",
        "srd-5.2.1"
      ],
      "provenance": {
        "sourceId": "5f5d5000-0000-4000-8000-000000000001",
        "page": {
          "start": 1
        }
      },
      "status": "published",
      "summary": "A test caster (prepared, int). Revision 2: its slots combine with other casters'.",
      "effects": [
        {
          "type": "hitDie",
          "id": "arcanist-hit-die",
          "die": 8
        },
        {
          "type": "spellcasting",
          "id": "arcanist-spellcasting",
          "ability": "int",
          "preparation": "prepared",
          "spellList": "fixture-arcane",
          "slotKind": "spellSlots",
          "slots": [
            [
              2,
              0,
              0,
              0,
              0
            ],
            [
              3,
              0,
              0,
              0,
              0
            ],
            [
              4,
              1,
              0,
              0,
              0
            ],
            [
              4,
              2,
              0,
              0,
              0
            ],
            [
              4,
              3,
              1,
              0,
              0
            ],
            [
              4,
              3,
              2,
              0,
              0
            ],
            [
              4,
              3,
              3,
              1,
              0
            ],
            [
              4,
              3,
              3,
              2,
              0
            ],
            [
              4,
              3,
              3,
              2,
              1
            ],
            [
              4,
              3,
              3,
              2,
              2
            ],
            [
              4,
              3,
              3,
              2,
              2
            ],
            [
              4,
              3,
              3,
              2,
              2
            ],
            [
              4,
              3,
              3,
              2,
              2
            ],
            [
              4,
              3,
              3,
              2,
              2
            ],
            [
              4,
              3,
              3,
              2,
              2
            ],
            [
              4,
              3,
              3,
              2,
              2
            ],
            [
              4,
              3,
              3,
              2,
              2
            ],
            [
              4,
              3,
              3,
              2,
              2
            ],
            [
              4,
              3,
              3,
              2,
              2
            ],
            [
              4,
              3,
              3,
              2,
              2
            ]
          ],
          "cantrips": [
            3,
            3,
            3,
            4,
            4,
            4,
            4,
            4,
            4,
            4,
            4,
            4,
            4,
            4,
            4,
            4,
            4,
            4,
            4,
            4
          ],
          "spellsFormula": "max(1, INT.MOD + CLASS_LEVEL)",
          "text": "Fixture Arcanist casts spells from the fixture-arcane list (test progression).",
          "multiclassCaster": "full"
        }
      ]
    }
  ]
}
