{
  "packId": "tomestack-turns-fixtures",
  "formatVersion": 1,
  "notice": "Original TomeStack test fixtures (play mechanics, content v11: upkeep at the turn's start or end, counting-up pools, per-turn allowances and toggle durations). Invented; no SRD or third-party rules text.",
  "sources": [
    {
      "id": "6f0d5000-0000-4000-8000-000000000030",
      "title": "TomeStack Fixtures: Turns",
      "publisher": "TomeStack project",
      "rulesFamilies": ["srd-5.2.1"],
      "editionVersion": "fixture-1",
      "license": "Original test fixture",
      "redistributable": true,
      "attribution": "Written for TomeStack tests."
    }
  ],
  "revisions": [
    {
      "contentId": "6f0dc000-0000-4000-8000-000000000030",
      "revisionId": "6f0de000-0000-4000-8000-000000000030",
      "schemaVersion": 11,
      "kind": "feature",
      "name": "Fixture Steady Discipline",
      "rulesFamilies": ["srd-5.2.1"],
      "provenance": { "sourceId": "6f0d5000-0000-4000-8000-000000000030", "page": { "start": 1 } },
      "status": "published",
      "summary": "A test feature that declares the stance group and the breath pool its stances spend.",
      "effects": [
        { "type": "toggleGroup", "id": "stances-group", "groupId": "stances", "label": "Stances" },
        { "type": "resource", "id": "breath", "resourceId": "breath", "label": "Breath", "maximum": "7" },
        { "type": "recovery", "id": "breath-long", "timing": "onLongRest", "resourceId": "breath", "on": "longRest", "amount": "all" }
      ]
    },
    {
      "contentId": "6f0dc000-0000-4000-8000-000000000031",
      "revisionId": "6f0de000-0000-4000-8000-000000000031",
      "schemaVersion": 11,
      "kind": "feature",
      "name": "Fixture Iron Stance",
      "rulesFamilies": ["srd-5.2.1"],
      "provenance": { "sourceId": "6f0d5000-0000-4000-8000-000000000030", "page": { "start": 2 } },
      "status": "published",
      "summary": "A test stance: costs 3 breath to enter, lasts 3 rounds, costs 2 breath at the start of each turn; +1 Armor Class.",
      "effects": [
        { "type": "toggle", "id": "iron", "toggleId": "iron", "label": "Iron stance", "group": "stances", "groupContent": "6f0dc000-0000-4000-8000-000000000030", "cost": "3", "resourceContent": "6f0dc000-0000-4000-8000-000000000030", "resourceId": "breath", "duration": "3" },
        { "type": "upkeep", "id": "iron-upkeep", "toggle": "iron", "at": "turnStart", "resourceContent": "6f0dc000-0000-4000-8000-000000000030", "resourceId": "breath", "change": "spend", "amount": "2" },
        { "type": "modifier", "id": "iron-ac", "timing": "whileActive", "toggle": "iron", "operation": "bonus", "target": "armorClass", "value": "1" }
      ]
    },
    {
      "contentId": "6f0dc000-0000-4000-8000-000000000032",
      "revisionId": "6f0de000-0000-4000-8000-000000000032",
      "schemaVersion": 11,
      "kind": "feature",
      "name": "Fixture Flare Overlay",
      "rulesFamilies": ["srd-5.2.1"],
      "provenance": { "sourceId": "6f0d5000-0000-4000-8000-000000000030", "page": { "start": 3 } },
      "status": "published",
      "summary": "A test overlay on the Iron stance: 1 breath each turn, which ends it if short, and strain that builds up by 1.",
      "effects": [
        { "type": "toggle", "id": "flare", "toggleId": "flare", "label": "Flare overlay", "group": "stances", "groupContent": "6f0dc000-0000-4000-8000-000000000030", "layer": "overlay", "allowedWith": [{ "contentId": "6f0dc000-0000-4000-8000-000000000031", "toggleId": "iron" }] },
        { "type": "upkeep", "id": "flare-breath", "toggle": "flare", "at": "turnStart", "resourceContent": "6f0dc000-0000-4000-8000-000000000030", "resourceId": "breath", "change": "spend", "amount": "1", "ifShort": "end" },
        { "type": "resource", "id": "strain", "resourceId": "strain", "label": "Strain", "maximum": "3", "counts": "up", "resourceFull": { "text": "Flare ends; take a level of exhaustion" } },
        { "type": "recovery", "id": "strain-long", "timing": "onLongRest", "resourceId": "strain", "on": "longRest", "amount": "all" },
        { "type": "upkeep", "id": "flare-strain", "toggle": "flare", "at": "turnStart", "resourceId": "strain", "change": "spend", "amount": "1" }
      ]
    },
    {
      "contentId": "6f0dc000-0000-4000-8000-000000000033",
      "revisionId": "6f0de000-0000-4000-8000-000000000033",
      "schemaVersion": 11,
      "kind": "feature",
      "name": "Fixture Quick Guard",
      "rulesFamilies": ["srd-5.2.1"],
      "provenance": { "sourceId": "6f0d5000-0000-4000-8000-000000000030", "page": { "start": 4 } },
      "status": "published",
      "summary": "A test per-turn allowance: one guard reaction, refreshed at the start of each turn.",
      "effects": [
        { "type": "resource", "id": "guard", "resourceId": "guard", "label": "Guard", "maximum": "1", "allowance": true },
        { "type": "upkeep", "id": "guard-refresh", "at": "turnStart", "resourceId": "guard", "change": "regain", "amount": "all" },
        { "type": "roll", "id": "parry", "rollId": "parry", "label": "Parry", "dice": "1d4", "resourceId": "guard", "cost": "1", "activation": "reaction" }
      ]
    },
    {
      "contentId": "6f0dc000-0000-4000-8000-000000000034",
      "revisionId": "6f0de000-0000-4000-8000-000000000034",
      "schemaVersion": 11,
      "kind": "feature",
      "name": "Fixture Second Wind Rhythm",
      "rulesFamilies": ["srd-5.2.1"],
      "provenance": { "sourceId": "6f0d5000-0000-4000-8000-000000000030", "page": { "start": 5 } },
      "status": "published",
      "summary": "A test feature that regains 1 breath at the end of each turn.",
      "effects": [
        { "type": "upkeep", "id": "rhythm", "at": "turnEnd", "resourceContent": "6f0dc000-0000-4000-8000-000000000030", "resourceId": "breath", "change": "regain", "amount": "1" }
      ]
    }
  ]
}
