{
  "packId": "tomestack-m2-fixtures",
  "formatVersion": 1,
  "notice": "Original TomeStack test fixtures (M2 item 4: equipment). Names and numbers are invented for testing and contain no SRD or third-party rules text.",
  "sources": [
    {
      "id": "5f4d5000-0000-4000-8000-000000000001",
      "title": "TomeStack Fixtures: Equipment",
      "publisher": "TomeStack project",
      "rulesFamilies": ["srd-5.1", "srd-5.2.1"],
      "editionVersion": "fixture-1",
      "license": "Original test fixture",
      "redistributable": true,
      "attribution": "Written for TomeStack tests."
    }
  ],
  "revisions": [
    {
      "contentId": "5f4dc000-0000-4000-8000-000000000001",
      "revisionId": "5f4de000-0000-4000-8000-000000000001",
      "schemaVersion": 3,
      "kind": "item",
      "name": "Fixture Padded Jerkin",
      "rulesFamilies": ["srd-5.1", "srd-5.2.1"],
      "provenance": { "sourceId": "5f4d5000-0000-4000-8000-000000000001", "page": { "start": 1 } },
      "status": "published",
      "summary": "Light test armor.",
      "effects": [
        { "type": "armor", "id": "jerkin-armor", "category": "light", "armorClass": 11, "text": "Light armor: 11 + Dexterity modifier." }
      ]
    },
    {
      "contentId": "5f4dc000-0000-4000-8000-000000000002",
      "revisionId": "5f4de000-0000-4000-8000-000000000002",
      "schemaVersion": 3,
      "kind": "item",
      "name": "Fixture Scale Vest",
      "rulesFamilies": ["srd-5.1", "srd-5.2.1"],
      "provenance": { "sourceId": "5f4d5000-0000-4000-8000-000000000001", "page": { "start": 1 } },
      "status": "published",
      "summary": "Medium test armor.",
      "effects": [
        { "type": "armor", "id": "vest-armor", "category": "medium", "armorClass": 14, "dexterityCap": 2, "text": "Medium armor: 14 + Dexterity modifier (at most +2)." }
      ]
    },
    {
      "contentId": "5f4dc000-0000-4000-8000-000000000003",
      "revisionId": "5f4de000-0000-4000-8000-000000000003",
      "schemaVersion": 3,
      "kind": "item",
      "name": "Fixture Iron Harness",
      "rulesFamilies": ["srd-5.1", "srd-5.2.1"],
      "provenance": { "sourceId": "5f4d5000-0000-4000-8000-000000000001", "page": { "start": 2 } },
      "status": "published",
      "summary": "Heavy test armor.",
      "effects": [
        { "type": "armor", "id": "harness-armor", "category": "heavy", "armorClass": 17, "text": "Heavy armor: 17, no Dexterity modifier." }
      ]
    },
    {
      "contentId": "5f4dc000-0000-4000-8000-000000000004",
      "revisionId": "5f4de000-0000-4000-8000-000000000004",
      "schemaVersion": 3,
      "kind": "item",
      "name": "Fixture Kite Shield",
      "rulesFamilies": ["srd-5.1", "srd-5.2.1"],
      "provenance": { "sourceId": "5f4d5000-0000-4000-8000-000000000001", "page": { "start": 2 } },
      "status": "published",
      "summary": "A test shield.",
      "effects": [
        { "type": "armor", "id": "kite-shield", "category": "shield", "armorClass": 2, "text": "Shield: +2 Armor Class." }
      ]
    },
    {
      "contentId": "5f4dc000-0000-4000-8000-000000000005",
      "revisionId": "5f4de000-0000-4000-8000-000000000005",
      "schemaVersion": 3,
      "kind": "item",
      "name": "Fixture Tome of Might",
      "rulesFamilies": ["srd-5.1", "srd-5.2.1"],
      "provenance": { "sourceId": "5f4d5000-0000-4000-8000-000000000001", "page": { "start": 3 } },
      "status": "published",
      "summary": "A test item that raises Strength by 4, to exercise the cap at 20.",
      "effects": [
        { "type": "modifier", "id": "tome-str", "operation": "bonus", "target": "ability.str.score", "value": "4" }
      ]
    }
  ]
}
