{
  "packId": "tomestack-target-marks-fixtures",
  "formatVersion": 1,
  "notice": "Original TomeStack test fixtures (MECH-X item 5, content v11: a player-set mark whose attack riders and roll mode follow a toggle). Invented; no SRD or third-party rules text.",
  "sources": [
    {
      "id": "6f0d5000-0000-4000-8000-000000000090",
      "title": "TomeStack Fixtures: Target Marks",
      "publisher": "TomeStack project",
      "rulesFamilies": ["srd-5.2.1"],
      "editionVersion": "fixture-1",
      "license": "Original test fixture",
      "redistributable": true,
      "attribution": "Written for TomeStack tests."
    }
  ],
  "revisions": [
    {
      "contentId": "6f0dc000-0000-4000-8000-000000000090",
      "revisionId": "6f0de000-0000-4000-8000-000000000090",
      "schemaVersion": 11,
      "kind": "feature",
      "name": "Fixture Sigil Mark",
      "rulesFamilies": ["srd-5.2.1"],
      "provenance": { "sourceId": "6f0d5000-0000-4000-8000-000000000090", "page": { "start": 1 } },
      "status": "published",
      "summary": "A test feature: a sigil pool and a mark toggle that adds extra damage dice to attacks and advantage on a skill while it is on.",
      "effects": [
        { "type": "resource", "id": "sigil", "resourceId": "sigil", "label": "Sigil", "maximum": "PB" },
        { "type": "recovery", "id": "sigil-long", "timing": "onLongRest", "resourceId": "sigil", "on": "longRest", "amount": "all" },
        { "type": "toggle", "id": "marked", "toggleId": "marked", "label": "Marked target present", "activation": "bonusAction", "resourceId": "sigil", "text": "Mark a creature you can see (1 sigil). While you say the marked target is present, your attacks deal an extra 1d6 force damage and you have advantage on Survival checks." },
        { "type": "attackRider", "id": "mark-dice", "tags": ["all"], "dice": "1d6", "damageType": "force", "toggle": "marked" },
        { "type": "rollMode", "id": "mark-track", "target": "skill.survival", "mode": "advantage", "toggle": "marked" }
      ]
    },
    {
      "contentId": "6f0dc000-0000-4000-8000-000000000091",
      "revisionId": "6f0de000-0000-4000-8000-000000000091",
      "schemaVersion": 11,
      "kind": "feature",
      "name": "Fixture Sigil Focus",
      "rulesFamilies": ["srd-5.2.1"],
      "provenance": { "sourceId": "6f0d5000-0000-4000-8000-000000000090", "page": { "start": 2 } },
      "status": "published",
      "summary": "A test feature: a flat bonus to hit on weapon attacks that follows the sigil mark's toggle.",
      "effects": [
        { "type": "attackRider", "id": "focus-hit", "tags": ["weapon"], "toHit": "1", "toggle": "marked", "toggleContent": "6f0dc000-0000-4000-8000-000000000090" }
      ]
    }
  ]
}
